{"corpus_catalog":{"byte_count":6670,"path":"evals/recursus/career-bench-v1/catalog.json","sha256":"279236023eceaa105aa0c13d20c5867d860423f0d6d297c3052074e1ad230200"},"harness_bundle_sha256":"e08d98956d42abc6d6ed3b069e9cba967186a639fa47278133a2dc218cea237c","harness_files":[{"byte_count":1673,"path":"capture-recursus-reference.mjs","sha256":"5aad973c6ff8f72cb267b1956e0e0b75d933f71a7a7aa9973975e60991467485"},{"byte_count":1458,"path":"evals/recursus/rc2-claude-code-reference-v1/schemas/invocation.schema.json","sha256":"6fdba19f079d66d7b0ae4e73d507bf8d60dbf895478c2ee4e3ca5cc6b1192ddf"},{"byte_count":1344,"path":"evals/recursus/rc2-claude-code-reference-v1/schemas/ledger-entry.schema.json","sha256":"8785c01645767cab6f593a7ffee0ad2103b0496f3abded9c9313f90aaa111a98"},{"byte_count":2088,"path":"evals/recursus/rc2-claude-code-reference-v1/schemas/normalized-result.schema.json","sha256":"7cdefe90b53e13e8e9ed25252399d0927ec8c54c2788d5b197f32550257efd68"},{"byte_count":2363,"path":"evals/recursus/rc2-claude-code-reference-v1/schemas/registration.schema.json","sha256":"63ddb9f07be1e04c4ab428d487c835406376cce930850a6a98c490a2b3b7d4cc"},{"byte_count":2265,"path":"evals/recursus/rc2-claude-code-reference-v1/schemas/runner-manifest.schema.json","sha256":"6a67fd53f1f8636d43561a4afa39d246811cfa05b9057ab15d764888e0d72011"},{"byte_count":1621,"path":"evals/recursus/rc2-claude-code-reference-v1/schemas/source-snapshot.schema.json","sha256":"bd853b0db8b7d98cdbd31357432f5c24f586c5275fdfd78e49d51eed1210f7df"},{"byte_count":845,"path":"evals/recursus/rc2-claude-code-reference-v1/schemas/trace.schema.json","sha256":"10ed96989ee4301ce3e9c7c59b4759beae6fdb793e4d4b7757e2fc243d8d618d"},{"byte_count":1416,"path":"evals/recursus/rc2-claude-code-reference-v1/schemas/validation-result.schema.json","sha256":"6a254b423dabbd86df0836d27c9dc52b9e1165be7b93c21ed6576581a37e7e8e"},{"byte_count":11472,"path":"lib/recursus-reference-capture.mjs","sha256":"8f1710a270f1b8cd2d4cf2275f0ef5202ca308537149e115387f87efe248bf94"},{"byte_count":70209,"path":"lib/recursus-reference.mjs","sha256":"00c2a7d929cd387f4dd97abb55df559149df0c3dda4981cb7cb8890ff71fdc5b"},{"byte_count":4077,"path":"package.json","sha256":"63f6446971c4e87ad5c3e6c27faf51aa7632ea12ad426f52406ac8195fcc8996"},{"byte_count":2928,"path":"prepare-recursus-reference.mjs","sha256":"f4eb5a5b203724f896267bcf29f1a27819a17f310ab5a5b596ee1604f2bf72cb"},{"byte_count":1847,"path":"verify-recursus-reference.mjs","sha256":"33369ddf5025949586d3de37254717ec2253a6c04d9b6307b9a596ca538d3660"}],"instruction_bundle_sha256":"57b36f561715e00046a9b1f72407cc343bcc3d3e67c5257d7115bf6d1a29c1d3","instruction_files":[{"byte_count":10188,"path":".agents/skills/career-ops/SKILL.md","sha256":"2f1d37bf7a84efcda91573925dad58a6fe304d77a0e6e415fa1ae8e9d027678c"},{"byte_count":41710,"path":"AGENTS.md","sha256":"a43d09b2b42d719c19f24b75ea2522951a0b4d7fa04a5715eb4292b474f465f9"},{"byte_count":103,"path":"CLAUDE.md","sha256":"4e39c2b90691943c74674c606a8df38c0f1861266e9010e7093816d130062a9d"},{"byte_count":16924,"path":"modes/_shared.md","sha256":"9c1619785765ad16145de43c7b342f4c839fd843a4cd3d83cfc01b2bc9e06fc4"},{"byte_count":8276,"path":"modes/_writing.md","sha256":"ec7549592feb604b9ef800169902a72232824eedfbde3020b5e6c72d399883f5"},{"byte_count":29042,"path":"modes/apply.md","sha256":"27383452c6a8d7db7c91bde319cd5a8edd99b8b26d7a06f0c5689498820d0e1f"},{"byte_count":2566,"path":"modes/heuristics/recruiter-side.md","sha256":"a22962edf419f9c63e39faf88367e3a95809f9319b23b69d6ce386de95125893"},{"byte_count":27504,"path":"modes/pdf.md","sha256":"5186cd795ef00b965a9a513a48df3f8353cd2ec2b7e99fdaea00c15cfbc9f22b"}],"product_baseline_revision":"bde5de661afbb72977a190e543ded24a72c9c86e","rc1_revision":"d2f2ad66133fa749e3b9b427b0de3dcad68d1295","registration_id":"RC2-CO-CLAUDE-CODE-2026-08-24-V1","repository":{"revision":"d2f2ad66133fa749e3b9b427b0de3dcad68d1295","url":"https://github.com/santifer/career-ops","working_tree_state":"uncommitted_rc2_implementation_files_hashed"},"schema_version":"1.0","snapshot_id":"RC2-SOURCE-SNAPSHOT-01","synthetic":true}
