{"corpus_catalog":{"byte_count":6670,"path":"evals/recursus/career-bench-v1/catalog.json","sha256":"279236023eceaa105aa0c13d20c5867d860423f0d6d297c3052074e1ad230200"},"harness_bundle_sha256":"b4323ed4e6399c8eb5c88f34860fb1a8f615e8ac6bbb40052cef0399ed9153d6","harness_files":[{"byte_count":2218,"path":"capture-recursus-reference-v3.mjs","sha256":"ec2f3d1e8871525ce4006c558a950f25911b64cda7883c6c1d0daa975330abc7"},{"byte_count":2128,"path":"evals/recursus/rc2-claude-code-reference-v3/README.md","sha256":"21a42b863a5951e8af395fe974c6c57cf83b723afb35e39a29b1382457e312b2"},{"byte_count":1959,"path":"evals/recursus/rc2-claude-code-reference-v3/schemas/invocation.schema.json","sha256":"c074ea9b30b656c9e864e37988d6400a310bfb10d906577d7a11e6dffa0f8a4c"},{"byte_count":2078,"path":"evals/recursus/rc2-claude-code-reference-v3/schemas/ledger-entry.schema.json","sha256":"2db514f62fdaec0b22a985a23271f436b90fbe2e94972f02b747dddd0a03416d"},{"byte_count":4243,"path":"evals/recursus/rc2-claude-code-reference-v3/schemas/normalized-result.schema.json","sha256":"a16f1cc0d125f03077c3cdb7e7a2ca776c91053f280a0c69b4b367caa916f2a8"},{"byte_count":8693,"path":"evals/recursus/rc2-claude-code-reference-v3/schemas/registration.schema.json","sha256":"a469ee85b3c20561f9772c1b2e30d754f70853b591efcf2ba6a73aebac0b92b2"},{"byte_count":8133,"path":"evals/recursus/rc2-claude-code-reference-v3/schemas/runner-manifest.schema.json","sha256":"6ce512b75072c155ef373c996be47f418610815aeb8d8b9833581864d9c22120"},{"byte_count":2089,"path":"evals/recursus/rc2-claude-code-reference-v3/schemas/source-snapshot.schema.json","sha256":"59f453498b8c5ac5264d88ac50a66a9137f23f290e46323680e53c11a6502162"},{"byte_count":1592,"path":"evals/recursus/rc2-claude-code-reference-v3/schemas/trace.schema.json","sha256":"f31fa19c796743803c6a6101a5ca8c7ac14f2f386e6a0395a49d8cdea4cc3416"},{"byte_count":2330,"path":"evals/recursus/rc2-claude-code-reference-v3/schemas/validation-result.schema.json","sha256":"2b58e08e1300eea5b34d7750b26ed556022c52b9a98fd95c788c3ac9432efe4e"},{"byte_count":60658,"path":"lib/recursus-benchmark.mjs","sha256":"769948690b99e00047035126fc3085875e30fd7b5f89df3a7785c8536c3a98b9"},{"byte_count":21038,"path":"lib/recursus-reference-capture-v3.mjs","sha256":"ca4b2544facc05cbf126d38f083980c5aa800ade9771e8270e0fa13ff370fc56"},{"byte_count":124842,"path":"lib/recursus-reference-v3.mjs","sha256":"3c25e8c5528ee5170d11a6b23afcf756ba95a0e773620477ef04a06f5d78c2b6"},{"byte_count":4086,"path":"package.json","sha256":"0ec7fd22aecf72aeacb7dad87e178f1bdd9b7a3bd7eb6fe72df8d38ccf73010a"},{"byte_count":3397,"path":"prepare-recursus-reference-v3.mjs","sha256":"226c82763cda35e8c8e83ece0727142e7792b8b4c82a69a2b6e9ef2b76b10c13"},{"byte_count":1853,"path":"verify-recursus-reference-v3.mjs","sha256":"970c7505f8396e14bf0d65c75d692a67bc87e05c73d13cee5ec8befde6c8eebb"}],"instruction_bundle_sha256":"57b36f561715e00046a9b1f72407cc343bcc3d3e67c5257d7115bf6d1a29c1d3","instruction_files":[{"byte_count":10188,"path":".agents/skills/career-ops/SKILL.md","sha256":"2f1d37bf7a84efcda91573925dad58a6fe304d77a0e6e415fa1ae8e9d027678c"},{"byte_count":41710,"path":"AGENTS.md","sha256":"a43d09b2b42d719c19f24b75ea2522951a0b4d7fa04a5715eb4292b474f465f9"},{"byte_count":103,"path":"CLAUDE.md","sha256":"4e39c2b90691943c74674c606a8df38c0f1861266e9010e7093816d130062a9d"},{"byte_count":16924,"path":"modes/_shared.md","sha256":"9c1619785765ad16145de43c7b342f4c839fd843a4cd3d83cfc01b2bc9e06fc4"},{"byte_count":8276,"path":"modes/_writing.md","sha256":"ec7549592feb604b9ef800169902a72232824eedfbde3020b5e6c72d399883f5"},{"byte_count":29042,"path":"modes/apply.md","sha256":"27383452c6a8d7db7c91bde319cd5a8edd99b8b26d7a06f0c5689498820d0e1f"},{"byte_count":2566,"path":"modes/heuristics/recruiter-side.md","sha256":"a22962edf419f9c63e39faf88367e3a95809f9319b23b69d6ce386de95125893"},{"byte_count":27504,"path":"modes/pdf.md","sha256":"5186cd795ef00b965a9a513a48df3f8353cd2ec2b7e99fdaea00c15cfbc9f22b"}],"product_baseline_revision":"bde5de661afbb72977a190e543ded24a72c9c86e","rc1_revision":"d2f2ad66133fa749e3b9b427b0de3dcad68d1295","registration_id":"RC2-CO-CLAUDE-CODE-2026-08-24-V3","repository":{"revision":"d2f2ad66133fa749e3b9b427b0de3dcad68d1295","url":"https://github.com/santifer/career-ops","working_tree_state":"uncommitted_rc2_implementation_files_hashed"},"schema_version":"1.0","snapshot_id":"RC2-SOURCE-SNAPSHOT-03","synthetic":true}
